{"after_tasks":[{"behavioral_config_sha256":"5f4a72be459d57a0cf68b9ea04d35292443eec8f4c052b197ea4ac2ff07475ab","default_timezone":"America/Vancouver","enabled":true,"execution_mode":"SAFE_REPLAY_ONLY","normalized_schedule":"TZID=America/Vancouver;FREQ=HOURLY;BYMINUTE=05","preactivation_inactive_result":"PREACTIVATION_WAIT","prompt_sha256":"a44b7b4b84eb1cf55abe9db77a663047556e59a013e40b74e3a9a2d4f00678ab","role_id":"MF01","scheduler_task_id":"6a8416348c848191b6b4908fea710e9f","timing_mode":"exact_schedule","title":"PS-MF-W01 | Representation Lab"},{"behavioral_config_sha256":"7e84259d39aeb1d34a9b770746580c02c27e94a2756646b00d4dbf7a29916aa8","default_timezone":"America/Vancouver","enabled":true,"execution_mode":"SAFE_REPLAY_ONLY","normalized_schedule":"TZID=America/Vancouver;FREQ=HOURLY;BYMINUTE=06","preactivation_inactive_result":"PREACTIVATION_WAIT","prompt_sha256":"d4b3e00c2380b7865e8ef5ce8619a954ac01f8932ca5a04a2b6b337e20bfbab5","role_id":"MF02","scheduler_task_id":"6a84163cd4fc81918b57cf7a25923976","timing_mode":"exact_schedule","title":"PS-MF-W02 | E1 Solver Routing"},{"behavioral_config_sha256":"fc8f93fd10e31fbb397573d141b1ea0f793801f1f4f81c0e1df0df2ed8c55593","default_timezone":"America/Vancouver","enabled":true,"execution_mode":"SAFE_REPLAY_ONLY","normalized_schedule":"TZID=America/Vancouver;FREQ=HOURLY;BYMINUTE=07","preactivation_inactive_result":"PREACTIVATION_WAIT","prompt_sha256":"d96768737f672980f3627e8a887d3fbfbc84cedf9e69ba6bd858d1c54e525f77","role_id":"MF03","scheduler_task_id":"6a84164563ec8191ac9a0902622eb676","timing_mode":"exact_schedule","title":"PS-MF-W03 | Lemma & Operator Lab"},{"behavioral_config_sha256":"d4167fa6d6088261c5df275c98fc81366657b4bcf800c9f54a0711189b560c32","default_timezone":"America/Vancouver","enabled":true,"execution_mode":"SAFE_REPLAY_ONLY","normalized_schedule":"TZID=America/Vancouver;FREQ=HOURLY;BYMINUTE=08","preactivation_inactive_result":"PREACTIVATION_WAIT","prompt_sha256":"19362bd1f8f9058bbf0500be79cb658de34c4755692d6993f512cbcab7966261","role_id":"MF04","scheduler_task_id":"6a84164c7bb0819192e2750f51587099","timing_mode":"exact_schedule","title":"PS-MF-W04 | Adversarial Falsifier"},{"behavioral_config_sha256":"136f988804ad1462ce2b8ed27c4b27334277d6874029b908b5a08cb67c2e8c11","default_timezone":"America/Vancouver","enabled":true,"execution_mode":"SAFE_REPLAY_ONLY","normalized_schedule":"TZID=America/Vancouver;FREQ=HOURLY;BYMINUTE=09","preactivation_inactive_result":"PREACTIVATION_WAIT","prompt_sha256":"e92e8b6ee5c31094fed0bdd790c837bf22961e09bf6e6f18d66213470325b80e","role_id":"MF05","scheduler_task_id":"6a8416576c288191b31eb63a52854388","timing_mode":"exact_schedule","title":"PS-MF-W05 | Product Closure"},{"behavioral_config_sha256":"8550b3bddb286c37ef762a5c5396e69e5f49ddfb18d6cb859ef9c2f0a177e49a","default_timezone":"America/Vancouver","enabled":true,"execution_mode":"SAFE_REPLAY_ONLY","normalized_schedule":"TZID=America/Vancouver;FREQ=HOURLY;BYMINUTE=10","preactivation_inactive_result":"PREACTIVATION_WAIT","prompt_sha256":"419270d9932bd48a82c3dd9a041c3ad1e65847602dd97f047726a1e4801bc7ab","role_id":"MM01","scheduler_task_id":"6a84166107d48191aaa2d95880e3b19e","timing_mode":"exact_schedule","title":"PS-MM-W01 | React Mechanisms"},{"behavioral_config_sha256":"690b1bf69b08a069c56ad338adffeb38c79a9ce6d77f1a38bbd51811f40adcfb","default_timezone":"America/Vancouver","enabled":true,"execution_mode":"SAFE_REPLAY_ONLY","normalized_schedule":"TZID=America/Vancouver;FREQ=HOURLY;BYMINUTE=11","preactivation_inactive_result":"PREACTIVATION_WAIT","prompt_sha256":"a81d5a90e82ca2245da43de7f3bedd010ba9e6f0a61502130e3382bf0cdadb6c","role_id":"MM02","scheduler_task_id":"6a84166713ac819185e377ef68a73788","timing_mode":"exact_schedule","title":"PS-MM-W02 | DeepSWE Mechanisms"},{"behavioral_config_sha256":"7d7f95782f71cbe1190c8dbc305ca65d0fae9305d0d2648688b8c3e6ed130a41","default_timezone":"America/Vancouver","enabled":true,"execution_mode":"SAFE_REPLAY_ONLY","normalized_schedule":"TZID=America/Vancouver;FREQ=HOURLY;BYMINUTE=12","preactivation_inactive_result":"PREACTIVATION_WAIT","prompt_sha256":"d3a6a54d03b06f3e7a242d7ebab3c0339913e57f0b82870c7c2c18d906b2219b","role_id":"MM03","scheduler_task_id":"6a84166ec498819187f84ad1bc350979","timing_mode":"exact_schedule","title":"PS-MM-W03 | SlopCode Contracts"},{"behavioral_config_sha256":"b15b5047e015451870ca3385218439578cc278fb0287e2965ba7d600db5a7597","default_timezone":"America/Vancouver","enabled":true,"execution_mode":"SAFE_REPLAY_ONLY","normalized_schedule":"TZID=America/Vancouver;FREQ=HOURLY;BYMINUTE=13","preactivation_inactive_result":"PREACTIVATION_WAIT","prompt_sha256":"2f587d711d65df43505bf72807ecc39a70db5c2a1d44c0a9cbcb86692c944b0d","role_id":"MM04","scheduler_task_id":"6a84167554548191904b4dbc7d2e059b","timing_mode":"exact_schedule","title":"PS-MM-W04 | Senior SWE Architecture"},{"behavioral_config_sha256":"1bf10b928fbe386ad7d3812947c18c188dfd3b040e889a659c6fb812af0e6c80","default_timezone":"America/Vancouver","enabled":true,"execution_mode":"SAFE_REPLAY_ONLY","normalized_schedule":"TZID=America/Vancouver;FREQ=HOURLY;BYMINUTE=14","preactivation_inactive_result":"PREACTIVATION_WAIT","prompt_sha256":"4c4d4f850ace984f802ca82cb17283cd101e60430a5eac092e3dd132e9c3a49e","role_id":"MM05","scheduler_task_id":"6a84167f810881919e2a300295a082fd","timing_mode":"exact_schedule","title":"PS-MM-W05 | E3 Mechanism Controls"},{"behavioral_config_sha256":"a14905cbf5b4dfd42919279945ea8668daa5a7f647f7894126004f0f14b20b98","default_timezone":"America/Vancouver","enabled":true,"execution_mode":"SAFE_REPLAY_ONLY","normalized_schedule":"TZID=America/Vancouver;FREQ=HOURLY;BYMINUTE=15","preactivation_inactive_result":"PREACTIVATION_WAIT","prompt_sha256":"d585a7aba8bcdd20646fb711ab51aa2511d07ab898b0b2ebaa92facb85104957","role_id":"MM07","scheduler_task_id":"6a841794fe288191893747cc6114f34b","timing_mode":"exact_schedule","title":"PS-MM-W07 | Before/After Self-Bench"},{"behavioral_config_sha256":"0753776627095cb4db97553fea89e10c27cf397f717218bde289c29338d56a39","default_timezone":"America/Vancouver","enabled":true,"execution_mode":"SAFE_REPLAY_ONLY","normalized_schedule":"TZID=America/Vancouver;FREQ=HOURLY;BYMINUTE=16","preactivation_inactive_result":"PREACTIVATION_WAIT","prompt_sha256":"a82e0ddafb90ffb40f432f96911863beb26fda28b0cc03f1bbd6d76d9261a6e2","role_id":"EXT01","scheduler_task_id":"6a84192d0f888191a4aaa9523fc07d7e","timing_mode":"exact_schedule","title":"PS-JOINT-A01 | Runtime & Transport Audit"},{"behavioral_config_sha256":"619ee1ae3bbfe23e1986e3c784c5cbbd97f6a1b471fbcef8a0c5d45852892c47","default_timezone":"America/Vancouver","enabled":true,"execution_mode":"SAFE_REPLAY_ONLY","normalized_schedule":"TZID=America/Vancouver;FREQ=HOURLY;BYMINUTE=35","preactivation_inactive_result":"PREACTIVATION_WAIT","prompt_sha256":"9803ff7a5c8acf59c1cbb9a6cb4c5808e4b8f6f523f467b0ce840a536f6e04c3","role_id":"MM06","scheduler_task_id":"6a84168b056481919c5ebfcb4f0a1ce4","timing_mode":"exact_schedule","title":"PS-JOINT-V01 | Evidence Verifier"},{"behavioral_config_sha256":"cffad3c7227b90d7ef6c50b90261c98fdb21e67fc4b110fc18c4ca68f4114c21","default_timezone":"America/Vancouver","enabled":true,"execution_mode":"SAFE_REPLAY_ONLY","normalized_schedule":"TZID=America/Vancouver;FREQ=HOURLY;BYMINUTE=45","preactivation_inactive_result":"PREACTIVATION_WAIT","prompt_sha256":"af108394b3e11237f9f70353c65db20b6ee3eed5a8486ce8047114b05abd36b8","role_id":"MF06","scheduler_task_id":"6a841697574481918e67222cacb7fcfb","timing_mode":"exact_schedule","title":"PS-JOINT-I01 | Evidence Integrator"},{"behavioral_config_sha256":"34507a2ac01b36107c67bb6b58ee35334744759f235d671e0c6c4b82c7e7c592","default_timezone":"America/Vancouver","enabled":true,"execution_mode":"SAFE_REPLAY_ONLY","normalized_schedule":"TZID=America/Vancouver;FREQ=HOURLY;BYMINUTE=58","preactivation_inactive_result":"PREACTIVATION_WAIT","prompt_sha256":"4ce94ada75ca459c8b941eff5e241f3a2903c8b202224792615967d99d79fb42","role_id":"BIL00","scheduler_task_id":"6a8413a9d7648191b06b1e8303dbcf77","timing_mode":"exact_schedule","title":"PS-JOINT-D01 | Director + 12h Research"}],"attestation_key_id":"PS-BIL00-INVENTORY-ROOT11-2026-08-23","attestation_tag":"5bec5d7a8ab4ad2e0cfd5e8f4930f7ff6afe5deca0adb061544a33da19fc0c34","attested_at_utc":"2026-08-27T03:00:09Z","attestor_role":"BIL00","attestor_scheduler_task_id":"6a8413a9d7648191b06b1e8303dbcf77","before_tasks":[{"behavioral_config_sha256":"5f4a72be459d57a0cf68b9ea04d35292443eec8f4c052b197ea4ac2ff07475ab","default_timezone":"America/Vancouver","enabled":true,"execution_mode":"SAFE_REPLAY_ONLY","normalized_schedule":"TZID=America/Vancouver;FREQ=HOURLY;BYMINUTE=05","preactivation_inactive_result":"PREACTIVATION_WAIT","prompt_sha256":"a44b7b4b84eb1cf55abe9db77a663047556e59a013e40b74e3a9a2d4f00678ab","role_id":"MF01","scheduler_task_id":"6a8416348c848191b6b4908fea710e9f","timing_mode":"exact_schedule","title":"PS-MF-W01 | Representation Lab"},{"behavioral_config_sha256":"7e84259d39aeb1d34a9b770746580c02c27e94a2756646b00d4dbf7a29916aa8","default_timezone":"America/Vancouver","enabled":true,"execution_mode":"SAFE_REPLAY_ONLY","normalized_schedule":"TZID=America/Vancouver;FREQ=HOURLY;BYMINUTE=06","preactivation_inactive_result":"PREACTIVATION_WAIT","prompt_sha256":"d4b3e00c2380b7865e8ef5ce8619a954ac01f8932ca5a04a2b6b337e20bfbab5","role_id":"MF02","scheduler_task_id":"6a84163cd4fc81918b57cf7a25923976","timing_mode":"exact_schedule","title":"PS-MF-W02 | E1 Solver Routing"},{"behavioral_config_sha256":"fc8f93fd10e31fbb397573d141b1ea0f793801f1f4f81c0e1df0df2ed8c55593","default_timezone":"America/Vancouver","enabled":true,"execution_mode":"SAFE_REPLAY_ONLY","normalized_schedule":"TZID=America/Vancouver;FREQ=HOURLY;BYMINUTE=07","preactivation_inactive_result":"PREACTIVATION_WAIT","prompt_sha256":"d96768737f672980f3627e8a887d3fbfbc84cedf9e69ba6bd858d1c54e525f77","role_id":"MF03","scheduler_task_id":"6a84164563ec8191ac9a0902622eb676","timing_mode":"exact_schedule","title":"PS-MF-W03 | Lemma & Ope